<?xml version="1.0" encoding="UTF-8"?>
<xs:schema attributeFormDefault="unqualified"
           elementFormDefault="qualified"
           targetNamespace="http://schemas.sulu.io/template/template"
           xmlns="http://schemas.sulu.io/template/template"
           xmlns:xs="http://www.w3.org/2001/XMLSchema">

    <!--
    Import XML namespace (used by xincludes)
    -->
    <xs:import namespace='http://www.w3.org/XML/1998/namespace' schemaLocation='xml.xsd'/>

    <xs:include schemaLocation="properties-1.0.xsd"/>

    <xs:element name="template" type="templateType"/>

    <xs:complexType name="templateType">
        <xs:choice maxOccurs="unbounded">
            <xs:element type="xs:string" name="key" minOccurs="1" maxOccurs="1"/>
            <xs:element type="indexType" name="index" minOccurs="1" maxOccurs="1"/>
            <xs:element type="tagType" name="tag" maxOccurs="unbounded"/>
            <xs:element type="xs:string" name="view" minOccurs="1" maxOccurs="1"/>
            <xs:element type="xs:string" name="controller" minOccurs="1" maxOccurs="1"/>
            <xs:element type="xs:string" name="internal" minOccurs="0" maxOccurs="1"/>
            <xs:element type="cacheLifetimeType" name="cacheLifetime" minOccurs="1" maxOccurs="1"/>
            <xs:element type="areasType" name="areas"/>
            <xs:element type="rootPropertiesType" name="properties" minOccurs="1" maxOccurs="1"/>

            <xs:element name="meta">
                <xs:complexType>
                    <xs:choice maxOccurs="unbounded">
                        <xs:element type="langType" name="title"/>
                    </xs:choice>
                    <xs:attributeGroup ref="defaultAttributes"/>
                </xs:complexType>
            </xs:element>
        </xs:choice>
        <xs:attributeGroup ref="defaultAttributes"/>
    </xs:complexType>

    <xs:complexType name="cacheLifetimeType">
        <xs:simpleContent>
            <xs:extension base="xs:string">
                <xs:attribute name="type" default="seconds">
                    <xs:simpleType>
                        <xs:union memberTypes="cacheLifetimeTypeEnum cacheLifetimeTypeAnyString"/>
                    </xs:simpleType>
                </xs:attribute>
            </xs:extension>
        </xs:simpleContent>
    </xs:complexType>

    <xs:simpleType name="cacheLifetimeTypeEnum">
        <xs:restriction base="xs:string">
            <xs:enumeration value="seconds"/>
            <xs:enumeration value="expression"/>
        </xs:restriction>
    </xs:simpleType>
    <xs:simpleType name="cacheLifetimeTypeAnyString">
        <xs:restriction base="xs:string">
            <xs:pattern value="[0-9a-zA-Z]*"/>
        </xs:restriction>
    </xs:simpleType>

    <xs:complexType name="indexType">
        <xs:simpleContent>
            <xs:extension base="xs:string">
                <xs:attribute type="xs:string" name="name" use="required"/>
                <xs:attributeGroup ref="defaultAttributes"/>
            </xs:extension>
        </xs:simpleContent>
    </xs:complexType>
</xs:schema>
