<?xml version="1.0" ?>
<template xmlns="http://schemas.sulu.io/template/template"
          xmlns:xsi="http://www.w3.org/2001/XMLSchema-instance"
          xsi:schemaLocation="http://schemas.sulu.io/template/template http://schemas.sulu.io/template/template-1.0.xsd">

    <key>text_block</key>

    <meta>
        <title lang="en">Text Block</title>
        <title lang="de">Text Block</title>
    </meta>

    <properties>
        <property name="title" type="text_line" mandatory="true">
            <meta>
                <title lang="en">Title</title>
                <title lang="de">Titel</title>
            </meta>

        </property>

        <property name="description" type="text_editor">
            <meta>
                <title lang="en">Description</title>
                <title lang="de">Beschreibung</title>
            </meta>
        </property>

        <block name="blocks" default-type="editor" minOccurs="0">
            <types>
                <type ref="text_block2" />
                <type name="editor">
                    <meta>
                        <title lang="en">Editor</title>
                        <title lang="de">Editor</title>
                    </meta>
                    <properties>
                        <property name="text_editor" type="text_editor">
                            <meta>
                                <title lang="en">Text Editor</title>
                                <title lang="de">Texteditor</title>
                            </meta>
                        </property>
                    </properties>
                </type>
            </types>
        </block>
    </properties>
</template>
