<?xml version="1.0" ?>

<template xmlns="http://schemas.sulu.io/template/template"
          xmlns:xsi="http://www.w3.org/2001/XMLSchema-instance"
          xsi:schemaLocation="http://schemas.sulu.io/template/template http://schemas.sulu.io/template/template-1.0.xsd"
          >

    <key>hotel</key>

    <properties>
        <property name="title" type="text_line" mandatory="true">
            <meta>
                <title lang="de">Name</title>
                <title lang="en">Name</title>
            </meta>

            <tag name="sulu.search.field" role="title" />

            <tag name="sulu.node.name"/>
            <tag name="sulu.rlp.part"/>
        </property>

        <property name="photo" type="media_selection" mandatory="false">
            <meta>
                <title lang="de">Foto</title>
                <title lang="en">Photo</title>
            </meta>
        </property>

        <property name="description" type="text_editor">
            <meta>
                <title lang="de">Beschreibung</title>
                <title lang="en">Description</title>
            </meta>

            <tag name="sulu.search.field" role="description" />
        </property>
    </properties>
</template>
