<?xml version="1.0" ?>

<template xmlns="http://schemas.sulu.io/template/template"
          xmlns:xsi="http://www.w3.org/2001/XMLSchema-instance"
          xsi:schemaLocation="http://schemas.sulu.io/template/template http://schemas.sulu.io/template/template-1.0.xsd"
          >

    <key>complex</key>

    <view>ClientWebsiteBundle:templates:animals</view>
    <controller>SuluWebsiteBundle:Default:index</controller>
    <cacheLifetime>2400</cacheLifetime>

    <meta>
        <title lang="de">Tiers</title>
        <title lang="en">Animals</title>
    </meta>

    <properties>
        <property name="title" type="text_line" mandatory="true">
            <meta>
                <title lang="de">Tier</title>
                <title lang="en">Animals</title>
            </meta>

            <tag name="sulu.rlp.part"/>
        </property>

        <property name="url" type="resource_locator" mandatory="true">
            <meta>
                <title lang="de">Adresse</title>
                <title lang="en">Resourcelocator</title>
            </meta>

            <tag name="sulu.rlp"/>
        </property>

        <block name="block1" 
               default-type="editor"
               minOccurs="2"
               maxOccurs="10"
               mandatory="true">
            <meta>
                <title lang="de">Block</title>
                <title lang="en">Block</title>
            </meta>
            <types>
                <type name="default">
                    <meta>
                        <title lang="de">Texteditor</title>
                        <title lang="en">Text editor</title>
                    </meta>
                    <properties>
                        <property name="title" type="text_line" mandatory="true">
                            <meta>
                                <title lang="de">Titel</title>
                                <title lang="en">Title</title>
                            </meta>
                        </property>
                        <property name="article" type="text_editor" mandatory="true">
                            <meta>
                                <title lang="de">Artikel</title>
                                <title lang="en">Article</title>
                            </meta>
                        </property>
                    </properties>
                </type>
            </types>
        </block>
    </properties>
</template>

